{
  "claims": [
    {
      "allowed_interpretation": "This records the historical screen disposition and its eligibility boundary only; summary-derived performance values remain exploratory.",
      "artifacts": [
        {
          "path": "docs/thesis/evidence/p1_18_variant_screen_disposition_2026-10-16.md",
          "role": "screen_disposition",
          "sha256": "1939509491043ffef4c52badacc2fcd6ce32f1f8628a0b33dbd1973686bd08fe"
        },
        {
          "path": "docs/thesis/evidence/p3_seed50_report_pack_recoverability_20261018.json",
          "role": "report_pack_recoverability_audit",
          "sha256": "810fe4f2108f9b41cbcd85c39afa9edf58cef6b87e66b1cca3eaae39d924ed1c"
        }
      ],
      "claim_id": "p1-screen-selection-disposition-seed50",
      "comparison_ids": [
        "seed50-18variant-screen-disposition"
      ],
      "evidence_role": "screening",
      "forbidden_overclaims": [
        "causal treatment effect",
        "profitability",
        "robust multi-seed effect",
        "generalization to a pristine holdout",
        "production readiness"
      ],
      "limitations": [
        "Single-seed exploratory screen.",
        "Lookahead was found in 17/18 configurations; the sole profile passing the bounded poison check failed the training survival gate.",
        "Raw report packs and checkpoints were not recovered in the audited outputs tree.",
        "The 2026 report interval was previously inspected and is not pristine confirmatory evidence.",
        "Feed identity, account-specific publication terms, schedule interpretation, and true sub-millisecond chronology remain unresolved."
      ],
      "rq": "P1 screen reconciliation / RQ1 candidate selection boundary",
      "statement": "The retained seed-50 18-variant campaign contains no candidate eligible for variant selection under the current causal and survival gates.",
      "thesis_destination": "Methods or appendix: screen disposition and evidence limitations."
    }
  ],
  "comparisons": [
    {
      "comparability_audit": [
        "18 run keys, seed 50, campaign fingerprint 91d2f05c4c13e67753a47b88a1c900f4887ced66dad51980a018eb09465dd10e.",
        "This is a reconciled screening set, not a matched causal comparison.",
        "No per-run raw report pack or checkpoint is linked as canonical numerical evidence."
      ],
      "comparison_id": "seed50-18variant-screen-disposition",
      "evidence_role": "screening",
      "figures_and_tables": [],
      "limitations": [
        "Summary report identity and run cards are traceability evidence only.",
        "No strategy-performance or selection claim is supported."
      ],
      "metrics": [
        {
          "notes": "Copied from the campaign summary; not canonical numerical reports.",
          "path": "outputs/gpu_campaigns/ladder18_seed50_20m_full_split_n64_cpumask_recovery_20261016/reports/campaign_results_summary_v2.json",
          "role": "summary_metrics",
          "sha256": "aeeb5eabab0fd568b619f368d4bb937265dbfd6f19bc32f1f85849af5cadbda7"
        }
      ],
      "question": "Does the retained one-seed screen provide an eligible variant for selection?",
      "run_ids": [
        "ladder_a0_flat__seed50",
        "ladder_a0_flat_dist__seed50",
        "ladder_a0_flat_po3__seed50",
        "ladder_a1_sl__seed50",
        "ladder_a1_sl_dist__seed50",
        "ladder_a1_sl_po3__seed50",
        "ladder_a2_tp__seed50",
        "ladder_a2_tp_dist__seed50",
        "ladder_a2_tp_po3__seed50",
        "ladder_a3_multi_tp__seed50",
        "ladder_a3_multi_tp_dist__seed50",
        "ladder_a3_multi_tp_po3__seed50",
        "ladder_a4a_entry_fsm_hidden__seed50",
        "ladder_a4a_entry_fsm_hidden_dist__seed50",
        "ladder_a4a_entry_fsm_hidden_po3__seed50",
        "ladder_a4b_distribution__seed50",
        "ladder_a4b_entry_fsm__seed50",
        "ladder_a4b_po3_ifvg__seed50"
      ],
      "statistics": [],
      "status": "complete"
    }
  ],
  "created_at_utc": "2026-10-18T02:26:41.393118+00:00",
  "frozen_at_utc": null,
  "limitations": [
    "Draft traceability manifest only; do not freeze until P1/P2/P3 acceptance and independent review.",
    "All run-level metrics are retained summary values with unavailable raw run artifacts.",
    "The linked ledger records historical campaign status and incomplete per-attempt provenance."
  ],
  "manifest_status": "draft",
  "protocol_path": "outputs/gpu_campaigns/ladder18_seed50_20m_full_split_n64_cpumask_recovery_20261016/campaign.json",
  "review_disposition": {
    "artifact": null,
    "open_findings": [
      "Independent review remains open.",
      "This draft does not establish admissibility of numerical results."
    ],
    "reviewed_at_utc": null,
    "reviewer": null,
    "status": "not_started"
  },
  "runs": [
    {
      "artifacts": [
        {
          "notes": "Summary-derived; not a canonical numerical report.",
          "path": "outputs/gpu_campaigns/ladder18_seed50_20m_full_split_n64_cpumask_recovery_20261016/reports/campaign_results_summary_v2.json",
          "role": "controller_summary",
          "sha256": "aeeb5eabab0fd568b619f368d4bb937265dbfd6f19bc32f1f85849af5cadbda7"
        },
        {
          "notes": "Traceability card; its copied metrics are not canonical.",
          "path": "outputs/gpu_campaigns/ladder18_seed50_20m_full_split_n64_cpumask_recovery_20261016/reports/findings/seed50_run_cards_20261018/ladder_a0_flat__seed50.md",
          "role": "finding_card",
          "sha256": "3753ca127087a57a3855729d8bcdae4265d565732dec334b2667e6b86869f96e"
        }
      ],
      "campaign_id": "ladder18_seed50_20m_full_split_n64_cpumask_recovery_20261016",
      "completed_timesteps": null,
      "data_calendar_role": "previously_inspected_selection_acknowledged_report_interval",
      "failure_disposition": "Campaign manifest status retained. Reported manifest state=failed; attempt records follow.",
      "full_split_exposure": "not_verified",
      "identity": {
        "cache_sha256": [],
        "checkpoint_sha256": null,
        "config_sha256": "ee10eb518736954028579c60812d6ce91fc99ac0aedcbc8c9256cbf86415ec56",
        "data_sha256": [
          "59c14312a9d42a53adbcdd24925f991e488d3c7346a583810ead57fb897ce897",
          "87716e3d6ee8d0f5031f83641f1e438931e29d7299a3c80114f34b9e51865d91",
          "d4563f58c5bd367dfa11a92a9cb22e9d3fb10a241575c2572046365a8422e6d9",
          "f0ee746eab46bada61b39a8877a4c40745eef8941e50ae9d01e149c4b127ad91"
        ],
        "git_sha": "413729ec3d68f342498434fba538b16a4b2776a7",
        "source_hash_manifest_path": "docs/thesis/evidence/seed50_recovery_source_manifest_20261018.json",
        "source_hash_manifest_sha256": "065e43657fe47600239909476a52945c8491d54fcfa5795f52af5f36f883e91f"
      },
      "interpretation_limitations": [
        "Raw per-run report pack and checkpoint were not recoverable in the audited outputs tree.",
        "Card disposition: failed; summary controller status: failed.",
        "No selection, causal-effect, profitability, robustness, or pristine-holdout claim is supported."
      ],
      "n_envs": 64,
      "requested_timesteps": 20000000,
      "role": "selection",
      "run_id": "ladder_a0_flat__seed50",
      "seed": 50,
      "status": "failed",
      "variant": "ladder_a0_flat"
    },
    {
      "artifacts": [
        {
          "notes": "Summary-derived; not a canonical numerical report.",
          "path": "outputs/gpu_campaigns/ladder18_seed50_20m_full_split_n64_cpumask_recovery_20261016/reports/campaign_results_summary_v2.json",
          "role": "controller_summary",
          "sha256": "aeeb5eabab0fd568b619f368d4bb937265dbfd6f19bc32f1f85849af5cadbda7"
        },
        {
          "notes": "Traceability card; its copied metrics are not canonical.",
          "path": "outputs/gpu_campaigns/ladder18_seed50_20m_full_split_n64_cpumask_recovery_20261016/reports/findings/seed50_run_cards_20261018/ladder_a0_flat_dist__seed50.md",
          "role": "finding_card",
          "sha256": "d43b862e2cc36f6052e40cb66574328056e6101ad2013c67d09e520dcc224927"
        }
      ],
      "campaign_id": "ladder18_seed50_20m_full_split_n64_cpumask_recovery_20261016",
      "completed_timesteps": null,
      "data_calendar_role": "previously_inspected_selection_acknowledged_report_interval",
      "failure_disposition": "Campaign manifest status retained. Reported manifest state=failed; attempt records follow.",
      "full_split_exposure": "not_verified",
      "identity": {
        "cache_sha256": [],
        "checkpoint_sha256": null,
        "config_sha256": "96d57742d2cd9f00d23bf8e0bf9b954123c41a5d0861f961e3bb66ac6dd25e8e",
        "data_sha256": [
          "59c14312a9d42a53adbcdd24925f991e488d3c7346a583810ead57fb897ce897",
          "87716e3d6ee8d0f5031f83641f1e438931e29d7299a3c80114f34b9e51865d91",
          "d4563f58c5bd367dfa11a92a9cb22e9d3fb10a241575c2572046365a8422e6d9",
          "f0ee746eab46bada61b39a8877a4c40745eef8941e50ae9d01e149c4b127ad91"
        ],
        "git_sha": "413729ec3d68f342498434fba538b16a4b2776a7",
        "source_hash_manifest_path": "docs/thesis/evidence/seed50_recovery_source_manifest_20261018.json",
        "source_hash_manifest_sha256": "065e43657fe47600239909476a52945c8491d54fcfa5795f52af5f36f883e91f"
      },
      "interpretation_limitations": [
        "Raw per-run report pack and checkpoint were not recoverable in the audited outputs tree.",
        "Card disposition: failed; summary controller status: failed.",
        "No selection, causal-effect, profitability, robustness, or pristine-holdout claim is supported."
      ],
      "n_envs": 64,
      "requested_timesteps": 20000000,
      "role": "selection",
      "run_id": "ladder_a0_flat_dist__seed50",
      "seed": 50,
      "status": "failed",
      "variant": "ladder_a0_flat_dist"
    },
    {
      "artifacts": [
        {
          "notes": "Summary-derived; not a canonical numerical report.",